{
  "version": 2.0,
  "success": true,
  "reason": null,
  "content": {
    "id": "7abca37c1c124cb2a4e74661f4a8c47e",
    "meetingNumber": "25967357926",
    "title": "Soar Sample Instant Meeting",
    "agenda": "Testing the application",
    "password": "abcd12345",
    "phoneAndVideoSystemPassword": "22231234",
    "meetingType": "meetingSeries",
    "state": "active",
    "timezone": "UTC",
    "start": "2022-08-11T13:33:00Z",
    "end": "2022-08-11T14:18:00Z",
    "hostUserId": "Y2lzY29zcGFyazovL3VzL1BFT1BMRS85ODM0YjBlYi1mZmY1LTRjY2YtYTcwOC04Nzk1YmFjYjQ3NzU",
    "hostDisplayName": "admin@examples-5xth.wbx.ai",
    "hostEmail": "admin@examples-5xth.wbx.ai",
    "hostKey": "109420",
    "siteUrl": "examples-5xth.webex.com",
    "webLink": "https://examples-5xth.webex.com/examples-5xth/j.php?MTID=m4a809400de110cbedaa89ff5e55b3d73",
    "sipAddress": "25967357926@examples-5xth.webex.com",
    "dialInIpAddress": "173.243.2.68",
    "enabledAutoRecordMeeting": "false",
    "allowAnyUserToBeCoHost": "false",
    "allowFirstUserToBeCoHost": "false",
    "allowAuthenticatedDevices": "true",
    "enabledJoinBeforeHost": "false",
    "joinBeforeHostMinutes": "0",
    "enableConnectAudioBeforeHost": "false",
    "excludePassword": "false",
    "publicMeeting": "false",
    "enableAutomaticLock": "false",
    "unlockedMeetingJoinSecurity": "allowJoin",
    "telephony": "accessCode:25967357926",
    "callInNumbers": "label:United States Toll",
    "callInNumber": "+1-000-000-0000",
    "tollType": "toll",
    "links": "rel:globalCallinNumbers",
    "href": "/v1/meetings/7abca37c1c124cb2a4e74661f4a8c47e/globalCallinNumbers",
    "method": "GET",
    "meetingOptions": "enabledChat:true",
    "enabledVideo": "true",
    "enabledPolling": "false",
    "enabledNote": "true",
    "noteType": "allowAll",
    "enabledClosedCaptions": "false",
    "enabledFileTransfer": "true",
    "enabledUCFRichMedia": "true",
    "sessionTypeId": "3",
    "scheduledType": "meeting",
    "simultaneousInterpretation": "enabled:false",
    "enabledBreakoutSessions": "false",
    "status": true
  },
  "raw": null,
  "inputs": {
    "webex_meeting_name": "Soar Sample Instant Meeting",
    "webex_meeting_password": "abcd12345",
    "webex_meeting_agenda": "Testing the application"
  },
  "metrics": {
    "version": "1.0",
    "package": "fn-webex",
    "package_version": "2.0.0",
    "host": "AppHost",
    "execution_time_ms": 5448,
    "timestamp": "2022-08-11 13:31:40"
  }
}