{
  "version": 2.0,
  "success": true,
  "reason": null,
  "content": {
    "id": "ae6049cbb70840a2899eeef49a6931db",
    "meetingNumber": "25962157846",
    "title": "Webex Initial Test",
    "password": "abcd1234",
    "phoneAndVideoSystemPassword": "22231234",
    "meetingType": "meetingSeries",
    "state": "active",
    "timezone": "UTC",
    "start": "2022-07-16T14:06:00Z",
    "end": "2022-07-16T14:40:00Z",
    "hostUserId": "Y2lzY29zcGFyazovL3VzL1BFT1BMRS9hNDE4YjJiMC02MTg2LTRlMjAtYmY0Yi0zNDFkMzJmZGU4NTk",
    "hostDisplayName": "admin@calvinwynne-8xjq.wbx.ai",
    "hostEmail": "admin@calvinwynne-8xjq.wbx.ai",
    "hostKey": "492825",
    "siteUrl": "calvinwynne-8xjq.webex.com",
    "webLink": "https://calvinwynne-8xjq.webex.com/calvinwynne-8xjq/j.php?MTID=mf668e6d5f22862e3d6d790b0b4fc5465",
    "sipAddress": "25962157846@calvinwynne-8xjq.webex.com",
    "dialInIpAddress": "173.243.2.68",
    "enabledAutoRecordMeeting": "false",
    "allowAnyUserToBeCoHost": "false",
    "allowFirstUserToBeCoHost": "false",
    "allowAuthenticatedDevices": "true",
    "enabledJoinBeforeHost": "false",
    "joinBeforeHostMinutes": "0",
    "enableConnectAudioBeforeHost": "false",
    "excludePassword": "false",
    "publicMeeting": "false",
    "enableAutomaticLock": "false",
    "unlockedMeetingJoinSecurity": "allowJoin",
    "telephony": "accessCode:25962157846",
    "callInNumbers": "label:United States Toll",
    "callInNumber": "+1-650-479-3208",
    "tollType": "toll",
    "links": "rel:globalCallinNumbers",
    "href": "/v1/meetings/ae6049cbb70840a2899eeef49a6931db/globalCallinNumbers",
    "method": "GET",
    "meetingOptions": "enabledChat:true",
    "enabledVideo": "true",
    "enabledPolling": "false",
    "enabledNote": "true",
    "noteType": "allowAll",
    "enabledClosedCaptions": "false",
    "enabledFileTransfer": "true",
    "enabledUCFRichMedia": "true",
    "sessionTypeId": "3",
    "scheduledType": "meeting",
    "simultaneousInterpretation": "enabled:false",
    "enabledBreakoutSessions": "false",
    "status": true
  },
  "raw": null,
  "inputs": {
    "webex_meeting_name": "Webex Initial Test",
    "webex_meeting_password": "abcd1234",
    "webex_meeting_start_time": 1657976762000,
    "webex_meeting_agenda": "",
    "webex_meeting_end_time": 1657978856000
  },
  "metrics": {
    "version": "1.0",
    "package": "fn-webex",
    "package_version": "1.0.0",
    "host": "Calvins-MacBook-Pro.local",
    "execution_time_ms": 2276,
    "timestamp": "2022-07-15 14:14:05"
  }
}